{
  "schema_version": "1.0.0",
  "image_id": "fixture_d2",
  "segment_id": "SEG_FIXTURE",
  "day": 2,
  "original_filename": "fixture_day2.jpg",
  "condition": null,
  "current_severity": null,
  "crack_area_ratio": null,
  "defect_area_ratio": 0.015,
  "defect_count": 1,
  "surface_anomaly_score": 0.25,
  "water_flag": false,
  "defects": [{"bbox": [10, 10, 33, 33], "centroid_x": 21, "centroid_y": 21, "area_ratio": 0.015, "defect_type": "pothole"}]
}
